{
  "$schema": "http://json-schema.org/draft-07/schema#",
  "type": "array",
  "items": {
    "type": "object",
    "required": ["id", "name", "school", "city", "province", "latitude", "longitude"],
    "properties": {
      "id": {
        "type": "string",
        "pattern": "^[a-z0-9-]+$"
      },
      "name": { "type": "string", "minLength": 1 },
      "school": { "type": "string", "minLength": 1 },
      "city": { "type": "string", "minLength": 1 },
      "province": { "type": "string", "minLength": 1 },
      "latitude": { "type": "number", "minimum": -90, "maximum": 90 },
      "longitude": { "type": "number", "minimum": -180, "maximum": 180 },
      "logo_url": { "type": "string" },
      "short_description": { "type": "string" },
      "long_description": { "type": "string" },
      "external_links": {
        "type": "array",
        "items": {
          "type": "object",
          "required": ["type", "url"],
          "properties": {
            "type": { "type": "string" },
            "url": { "type": "string", "format": "uri" }
          }
        },
        "default": []
      },
      "tags": {
        "type": "array",
        "items": { "type": "string" },
        "default": []
      }
    },
    "additionalProperties": false
  }
}