[
  {
    "id": "club-001",
    "name": "测试社团",
    "school": "测试大学1",
    "city": "深圳",
    "province": "广东省",
    "latitude": 22.700346,
    "longitude": 114.404883,
    "logo_url": "assets/logos/placeholder.png",
    "short_description": "专注于游戏开发的社团",
    "long_description": "我们致力于学习游戏开发技术，包括Unity、Unreal等引擎，定期举办Game Jam和技术分享会。",
    "external_links": [
      {
        "type": "website",
        "url": "https://example.com"
      }
    ],
    "tags": ["游戏开发", "Unity", "技术"]
  },
  {
    "id": "club-002",
    "name": "厦门大学第九艺术游创社",
    "school": "厦门大学",
    "city": "厦门",
    "province": "福建省",
    "latitude": 24.607377,
    "longitude": 118.309695,
    "logo_url": "assets/logos/xmu-game-club.png",
    "short_description": "厦门大学游戏开发社团",
    "long_description": "厦大唯一指定游戏开发社团，涵盖三个校区，社团宗旨为缔结震撼人心的艺术品",
    "tags": [ "正式社团" ]
  },
  {
    "id": "club-003",
    "name": "萌屋",
    "school": "湘潭大学",
    "city": "湘潭",
    "province": "湖南省",
    "latitude": 27.882942,
    "longitude": 112.863096,
    "logo_url": "assets/logos/Cutyroom-game-club.png",
    "short_description": "湘潭大学的游戏开发组织Cutyroom Studio欢迎大家",
    "long_description": "欢迎了解Cutyroom，我们大致分为程序，策划，美术三个方向，主打unity引擎的游戏开发，热衷于参加各类gamejam，定期举办分享会等活动，有多部游戏现已登录平台,官方的网站正在制作中",
    "external_links": [
        {
            "type": "website",
            "url": "https://www.taptap.cn/app/726467?os=pc"
        },
        {
            "type": "website",
            "url": "https://www.gcores.com/games/141972"
        }
    ],
    "tags": [ "正式社团", "游戏开发", "unity", "策划", "2d与3d美术" ]
  }
]